{
  "opentodoTheme": 1,
  "id": "opentodo-light",
  "name": "OpenTodo Light",
  "author": "OpenTodo contributors",
  "licence": "AGPL-3.0-only",
  "source": "web/src/index.css",
  "kind": "light",
  "seeds": {
    "canvas": "oklch(0.9542 0.0034 247.86)",
    "surface": "oklch(1 0 0)",
    "text": "oklch(0.2126 0.0067 258.37)",
    "accent": "oklch(0.5081 0.1049 165.61)"
  },
  "tokens": {
    "canvas": "#eef0f2",
    "surface": "#ffffff",
    "raised": "#f7f7f7",
    "sunken": "#f1f3f5",
    "pop": "#ffffff",
    "hover": "#f8f8f8",
    "selected": "#e7e9ec",
    "selected-row": "#f1f3f5",
    "sidebar": "#eef0f2",
    "text-strong": "#17191c",
    "text": "#17191c",
    "muted": "#5c6169",
    "faint": "#62686f",
    "border": "#dee0e3",
    "border-soft": "#e1e3e6",
    "border-input": "#7c8799",
    "line-strong": "#d4d7db",
    "accent": "#047857",
    "accent-hover": "#036146",
    "on-accent": "#ffffff",
    "accent-text": "#047857",
    "accent-soft": "#e9f1ed",
    "accent-soft-text": "#02573e",
    "focus": "#3f8c6e",
    "success": "#047857",
    "success-soft": "#ecfdf5",
    "success-soft-text": "#065f46",
    "warning": "#8a5200",
    "warning-soft": "#fffbeb",
    "warning-soft-text": "#92400e",
    "danger": "#bd2f2a",
    "danger-soft": "#fef2f2",
    "danger-soft-text": "#991b1b",
    "info": "#2860c0",
    "info-soft": "#f0f9ff",
    "info-soft-text": "#075985",
    "p1": "#dc2626",
    "p1-soft": "#fef2f2",
    "p2": "#ea580c",
    "p2-soft": "#fff7ed",
    "p3": "#2563eb",
    "p3-soft": "#eff6ff",
    "p4": "#64748b",
    "p4-soft": "#f8fafc",
    "hue-red": "#dc2626",
    "hue-orange": "#ea580c",
    "hue-yellow": "#d27100",
    "hue-lime": "#4d7c0f",
    "hue-green": "#059e45",
    "hue-teal": "#0d9488",
    "hue-cyan": "#0891b2",
    "hue-blue": "#2563eb",
    "hue-indigo": "#4f46e5",
    "hue-violet": "#7c3aed",
    "hue-pink": "#db2777",
    "hue-slate": "#64748b",
    "scrim": "#02061759",
    "highlight": "#fde68a",
    "highlight-text": "#0f172a",
    "chart-base": "#047857",
    "chart-seq-1": "#e4e5e7",
    "chart-seq-2": "#93bca9",
    "chart-seq-3": "#6da58d",
    "chart-seq-4": "#479073",
    "chart-seq-5": "#047857"
  },
  "bar": "#047857"
}
