{
  "opentodoTheme": 1,
  "id": "opentodo-dark",
  "name": "OpenTodo Dark",
  "author": "OpenTodo contributors",
  "licence": "AGPL-3.0-only",
  "source": "web/src/index.css",
  "kind": "dark",
  "seeds": {
    "canvas": "oklch(0.1635 0.0045 264.44)",
    "surface": "oklch(0.1959 0.0062 271.09)",
    "text": "oklch(0.9459 0.0029 264.54)",
    "accent": "oklch(0.5081 0.1049 165.61)"
  },
  "tokens": {
    "canvas": "#0d0e10",
    "surface": "#141518",
    "raised": "#191a1e",
    "sunken": "#111215",
    "pop": "#1b1c20",
    "hover": "#18191d",
    "selected": "#25272c",
    "selected-row": "#1d1f23",
    "sidebar": "#0d0e10",
    "text-strong": "#ecedef",
    "text": "#ecedef",
    "muted": "#a3a7ae",
    "faint": "#8d929b",
    "border": "#232529",
    "border-soft": "#212327",
    "border-input": "#7a818d",
    "line-strong": "#2e3136",
    "accent": "#047857",
    "accent-hover": "#036146",
    "on-accent": "#ffffff",
    "accent-text": "#34d399",
    "accent-soft": "#1d2b28",
    "accent-soft-text": "#6fddad",
    "focus": "#34d399",
    "success": "#34d399",
    "success-soft": "#022c22",
    "success-soft-text": "#6ee7b7",
    "warning": "#e5a54a",
    "warning-soft": "#451a03",
    "warning-soft-text": "#fcd34d",
    "danger": "#f0716d",
    "danger-soft": "#450a0a",
    "danger-soft-text": "#fca5a5",
    "info": "#6b9ef0",
    "info-soft": "#082f49",
    "info-soft-text": "#7dd3fc",
    "p1": "#f87171",
    "p1-soft": "#281112",
    "p2": "#fb923c",
    "p2-soft": "#271511",
    "p3": "#60a5fa",
    "p3-soft": "#151b30",
    "p4": "#64748b",
    "p4-soft": "#181d26",
    "hue-red": "#f87171",
    "hue-orange": "#fb923c",
    "hue-yellow": "#fbbf24",
    "hue-lime": "#a3e635",
    "hue-green": "#4ade80",
    "hue-teal": "#2dd4bf",
    "hue-cyan": "#22d3ee",
    "hue-blue": "#60a5fa",
    "hue-indigo": "#818cf8",
    "hue-violet": "#a78bfa",
    "hue-pink": "#f472b6",
    "hue-slate": "#94a3b8",
    "scrim": "#0000008c",
    "highlight": "#854d0e",
    "highlight-text": "#fef3c7",
    "chart-base": "#34d399",
    "chart-seq-1": "#25262a",
    "chart-seq-2": "#2e6a53",
    "chart-seq-3": "#328c6a",
    "chart-seq-4": "#35ad80",
    "chart-seq-5": "#34d399"
  },
  "bar": "#0d0e10"
}
