{
  "opentodoTheme": 1,
  "id": "catppuccin-latte",
  "name": "Catppuccin Latte",
  "author": "Catppuccin",
  "licence": "MIT",
  "source": "https://github.com/catppuccin/catppuccin",
  "kind": "light",
  "seeds": {
    "canvas": "#e6e9ef",
    "surface": "#eff1f5",
    "text": "#4c4f69",
    "accent": "oklch(0.5347 0.2503 297.02)",
    "success": "oklch(0.49 0.1593 140.44)",
    "warning": "oklch(0.509 0.1119 67.78)",
    "danger": "oklch(0.5305 0.213 19.81)",
    "info": "oklch(0.5186 0.2255 262.09)"
  },
  "tokens": {
    "muted": "oklch(0.5071 0.0343 279.08)",
    "faint": "oklch(0.5061 0.0269 278.12)",
    "hue-red": "#d20f39",
    "hue-orange": "oklch(0.637 0.1907 42.43)",
    "hue-yellow": "oklch(0.6265 0.1377 67.78)",
    "hue-lime": "oklch(0.6044 0.1667 131.59)",
    "hue-green": "oklch(0.6025 0.1772 140.44)",
    "hue-teal": "#179299",
    "hue-cyan": "oklch(0.612 0.1305 235.38)",
    "hue-blue": "#1e66f5",
    "hue-indigo": "oklch(0.6288 0.1751 273.13)",
    "hue-violet": "#8839ef",
    "hue-pink": "oklch(0.6406 0.1739 338.43)",
    "hue-slate": "#7c7f93"
  },
  "bar": "#e6e9ef",
  "notes": {
    "adapted": {
      "accent": "#8839ef",
      "success": "#40a02b",
      "warning": "#df8e1d",
      "danger": "#d20f39",
      "info": "#1e66f5",
      "muted": "#6c6f85",
      "faint": "#8c8fa1",
      "hue-orange": "#fe640b",
      "hue-yellow": "#df8e1d",
      "hue-green": "#40a02b",
      "hue-cyan": "#04a5e5",
      "hue-indigo": "#7287fd",
      "hue-pink": "#ea76cb"
    },
    "text": "Catppuccin Latte by Catppuccin, mapped onto OpenTodo's tokens by web/src/lib/theme/builtin/MAPPING.md. Label colours not in the palette (lime) use OpenTodo's hue at the palette's lightness and chroma. Some colours were adapted for contrast: their published values are under adapted."
  }
}
