{
  "$schema": "https://raw.githubusercontent.com/OpenTodoApp/OpenTodo/main/docs/themes/opentodo-theme.schema.json",
  "opentodoTheme": 1,
  "id": "example-with-schema",
  "name": "Example with a schema",
  "author": "OpenTodo contributors",
  "licence": "CC0-1.0",
  "kind": "dark",
  "seeds": {
    "canvas": "#1e2127",
    "surface": "#282c34",
    "text": "#e6e6e6",
    "accent": "#61afef"
  }
}
