{
  "opentodoTheme": 1,
  "id": "example-dark",
  "name": "Example Dark",
  "author": "OpenTodo contributors",
  "licence": "CC0-1.0",
  "kind": "dark",
  "seeds": {
    "canvas": "#1e2127",
    "surface": "#282c34",
    "text": "#e6e6e6",
    "accent": "#61afef"
  },
  "tokens": {
    "scrim": "#000000a0"
  },
  "shape": {
    "radius": {
      "card": 0
    }
  },
  "type": {
    "family": "mono"
  }
}
